{
  "$schema": "https://json-schema.org/draft/2020-12/schema",
  "$id": "https://basidiocarp.dev/septa/cortina-lifecycle-event-v1.schema.json",
  "title": "Cortina Lifecycle Event v1",
  "description": "Normalized lifecycle event vocabulary emitted by Cortina for transferable host, tool, session, compaction, council, and message lifecycle semantics. Producer: cortina/src/events/normalized_lifecycle.rs. Consumers: downstream orchestrators and dashboards that need a host-agnostic lifecycle shape. v1.1 adds the 'message' category for host MessageDisplay events.",
  "type": "object",
  "required": [
    "schema_version",
    "category",
    "status",
    "host",
    "event_name",
    "summary",
    "fail_open"
  ],
  "properties": {
    "schema_version": { "const": "1.1" },
    "category": {
      "type": "string",
      "enum": ["host", "tool", "session", "compaction", "council", "message"]
    },
    "status": {
      "type": "string",
      "enum": ["requested", "captured", "started", "completed", "failed"]
    },
    "host": {
      "$ref": "host-identifier-v1.schema.json",
      "description": "AI coding agent host that produced this event."
    },
    "event_name": {
      "type": "string",
      "minLength": 1
    },
    "summary": {
      "type": "string",
      "minLength": 1
    },
    "fail_open": {
      "type": "boolean"
    },
    "session_id": {
      "type": ["string", "null"]
    },
    "cwd": {
      "type": ["string", "null"]
    },
    "project_root": {
      "type": ["string", "null"]
    },
    "worktree_id": {
      "type": ["string", "null"]
    },
    "tool_name": {
      "type": ["string", "null"]
    },
    "trigger": {
      "type": ["string", "null"]
    },
    "metadata": {
      "type": "object",
      "additionalProperties": true
    }
  },
  "additionalProperties": false
}
