{
  "schema_version": "1.1",
  "category": "message",
  "status": "captured",
  "host": "claude_code",
  "event_name": "message_display",
  "summary": "assistant message surfaced to operator",
  "fail_open": true,
  "session_id": "ses_example",
  "cwd": "/tmp/demo",
  "project_root": null,
  "worktree_id": null,
  "tool_name": null,
  "trigger": null,
  "metadata": {
    "message_excerpt": "Build is green; opening the PR now.",
    "transcript_path": "/tmp/demo/transcript.jsonl"
  }
}
